Unknown speaker,Survivor,Sigsbee,Politicians,Military personnel ,Journalists,Experts,"20 context hits for ""public"" / ""opinion"""
,,,,Accident,,,"men and 2 officers were killed in the explosion . The chief of the naval office here is of the opinion that the explosion took place in the warehouse where the gun cotton for the torpedoes was gobor"
,,,,Accident,,,"236 men and 2 officers were killed in the blast . The chief of the naval office here is of the opinion that the blast found plains in the warehouse , where the gun cotton was for the torpedoes . The"
,,,,Accident,,,"men and 2 officers were killed in the explosion . The chief of the naval office here is of the opinion that the explosion took place in the warehouse where the gun cotton for the torpedoes was store"
Attack,,,,,,,"ounds for the supposition that she too sees the matter very seriously and an outburst of public opinion , most , as the jingus will not believe in any chance and will accuse the Spaniards of malice ."
Undecided/Unclear,,,,,,,"n an unofficial message that the government believed in a coincidental incident . `` `` General opinion , assures a telegram from Washington to the Dai 1 y Ch ro nic 1 st , '' '' that when The loss o"
,,Suspend Opinion,,,,,"d y * n 'r * ifbuot and an American ? s ? mMB lack of sufficient information . n 1 , the public opinion abstain kPu dlron » .r « rdee , in * concerning the causes SredIIP . two of them woolen , howev"
,,,,,Attack,,"the discovery and conviction of criminal intent in these Other magazines try to calm the public opinion that the disaster would be a consequence of SÜS nl ™ `` ^ '' . The Times Gn d ; t H ? aïid Will"
,,,,,Attack,,"h machine could be hidden in the ship . The investigation may still shed light on this . Public opinion in the United States demands certainty in this regard , even doubt could become dangerous given"
,,,,,Attack,,"t a hellish machine was hidden in the ship ; the research can still shed light on this . Public opinion in the United States demands certainty in this regard ; even doubt could become dangerous in th"
,,Suspend Opinion,,,,,"rican fleet would make a fatal impression is borne out . Captain Sigebes can signal that public opinion should not be judged too quickly . This word did not find its place in the existing bitterness"
,,,,Accident,,,". 268 men and 2 officers were killed in the explosion . The chief of the naval office is of the opinion that the detonation took place in the warehouse , where the shooting cotton for the torpedoes ."
Attack,,,,,,,"t a hellish machine was hidden in the ship ; the research can still shed light on this . Public opinion in the United States demands certainty in this regard ; even doubt could become dangerous in th"
,,,Undecided/Unclear,,,,"fore the blame would be on a foreign government . Yet the Jingos maintain this , expressing the opinion that now is the time for the Government to act officially . It would be desirable for the Ameri"
,,,,Accident,,,"men and 2 officers have been killed in the explosion . The chief of the naval office is of the opinion that the explosion took place found in the warehouse where the gun cotton for the torpedoes was"
Attack,,,,,,,"lish machine was concealed in the ship , the investigation may still shed light on . The public opinion in the United States demands certainty in this regard , and even doubt could become dangerous i"
,,,Accident,,,,"`` Maine '' was the principal subject of discussions . The President and the Cabinet are of the opinion that an unfortunate coincidence is the cause of the fatal event , and a very careful investigat"
,,,Accident,,,,"of Maine was the principal subject of deliberations . The president and the cabinet are of the opinion that an unfortunate coincidence is the cause of the fatal event , but they consider a very care"